Name,Price,Old Price,Rating,Product Image
For Airtags Leather Case Keychain Protective Sleeve,"₦ 2,299","₦ 4,976",No rating,https://ng.jumia.is/unsafe/fit-in/300x300/filters:fill(white)/product/20/0305113/1.jpg?1161
Airtag-compatible Cover Collar For Cat Portable Anti-Lost,"₦ 5,812","₦ 8,050",5 out of 5,https://ng.jumia.is/unsafe/fit-in/300x300/filters:fill(white)/product/36/8143262/1.jpg?7026
Mutural Airtag Silicone Watch Band Compatible With Airtag,"₦ 18,000",No old price,No rating,https://ng.jumia.is/unsafe/fit-in/300x300/filters:fill(white)/product/74/7483333/1.jpg?6204
"2Pcs Case Compatible for Apple Airtag, PU Leather Skin Cover with Keychain Holder Key Ring for Air Tag Accessories Black","₦ 4,641","₦ 8,725",2.3 out of 5,https://ng.jumia.is/unsafe/fit-in/300x300/filters:fill(white)/product/92/6940432/1.jpg?5361
(black 01)Leather Keychain For Apple Airtags Case Protector Cover Shell Tracker Anti-scratch For Air Tag Key Ring Holder Accessories RA,"₦ 23,798","₦ 29,748",4 out of 5,https://ng.jumia.is/unsafe/fit-in/300x300/filters:fill(white)/product/22/1078132/1.jpg?8810
4-Pack Silicone Case Compatible With Apple AirTag,"₦ 9,571","₦ 13,531",5 out of 5,https://ng.jumia.is/unsafe/fit-in/300x300/filters:fill(white)/product/44/100487/1.jpg?7412
Apple AirTag Air Tag Tracker,"₦ 60,000",No old price,2 out of 5,https://ng.jumia.is/unsafe/fit-in/300x300/filters:fill(white)/product/36/2819532/1.jpg?5212
Apple Airtag 4 Pack - Bluetooth Tracker,"₦ 175,000",No old price,4.9 out of 5,https://ng.jumia.is/unsafe/fit-in/300x300/filters:fill(white)/product/93/092479/1.jpg?2925
Airtag-compatible Cover Collar For Cat Portable Anti-Lost,"₦ 7,446","₦ 14,760",No rating,https://ng.jumia.is/unsafe/fit-in/300x300/filters:fill(white)/product/46/3068952/1.jpg?3688
Anti-Lost Alarm Tag Mini Gps Tracker Global Tracker Gps Locator For Airtag Anti Lose Reminder Bluetooth Wireless Child Finder,"₦ 35,358","₦ 60,114",No rating,https://ng.jumia.is/unsafe/fit-in/300x300/filters:fill(white)/product/14/8891472/1.jpg?8798
For AirPods Pro 2 / Airtag 2 In 1 All-inclusive Silicone Anti-drop Protection Case(Deep Blue),"₦ 4,068","₦ 6,108",No rating,https://ng.jumia.is/unsafe/fit-in/300x300/filters:fill(white)/product/89/9404033/1.jpg?9419
Bluetooth Gps Tracker Device Suitable For Airtag Apple Tracking Locator Pet Children Elderly Multiple Types Of Gps Locator,"₦ 37,684","₦ 64,061",No rating,https://ng.jumia.is/unsafe/fit-in/300x300/filters:fill(white)/product/76/1139272/1.jpg?7729
Airtag-compatible Cover Collar For Cat Portable Anti-Lost,"₦ 5,646","₦ 7,650",No rating,"data:image/gif;base64,R0lGODlhAQABAIAAAAAAAP///yH5BAEAAAAALAAAAAABAAEAAAIBRAA7"
New Pet Collar For Airtag Dog Cat Strap Adjustable Sleeve Suitable Air Tags Anti-Scratch Protective Cover For Airtags Case,"₦ 24,255","₦ 32,781",No rating,"data:image/gif;base64,R0lGODlhAQABAIAAAAAAAP///yH5BAEAAAAALAAAAAABAAEAAAIBRAA7"
"Silicone Case Compatible With AirTag, Bluetooth Tracker Holder With Key Chain, Lightweight Anti-Scratch Cover For AirTag Loop","₦ 6,580","₦ 11,860",No rating,"data:image/gif;base64,R0lGODlhAQABAIAAAAAAAP///yH5BAEAAAAALAAAAAABAAEAAAIBRAA7"
适用苹果Airtag保护套 苹果Airtag硅胶定位追踪器便携防丢保护套 紫丁香 Airtag,"₦ 3,260","₦ 6,520",No rating,"data:image/gif;base64,R0lGODlhAQABAIAAAAAAAP///yH5BAEAAAAALAAAAAABAAEAAAIBRAA7"
Airtag-compatible Cover Collar For Cat Portable Anti-Lost,"₦ 3,680",No old price,No rating,"data:image/gif;base64,R0lGODlhAQABAIAAAAAAAP///yH5BAEAAAAALAAAAAABAAEAAAIBRAA7"
Bluetooth Key Finder with Global Apple Find My Network(iOS Only) Smart AirTag cker Item for Bags Luage,"₦ 61,020","₦ 103,950",No rating,"data:image/gif;base64,R0lGODlhAQABAIAAAAAAAP///yH5BAEAAAAALAAAAAABAAEAAAIBRAA7"
"4 Pack Air Tag Holder, Tag Key Ring, Keychain AirTags Case","₦ 88,223","₦ 88,250",No rating,"data:image/gif;base64,R0lGODlhAQABAIAAAAAAAP///yH5BAEAAAAALAAAAAABAAEAAAIBRAA7"
Watch Band Airtag Gps Tracker Holder Toddler Wristband with Adjustable Black,"₦ 3,540","₦ 5,311",No rating,"data:image/gif;base64,R0lGODlhAQABAIAAAAAAAP///yH5BAEAAAAALAAAAAABAAEAAAIBRAA7"
Carbon Fiber Pattern Tracker Case Cover For Apple AirTags,"₦ 7,876","₦ 8,986",5 out of 5,"data:image/gif;base64,R0lGODlhAQABAIAAAAAAAP///yH5BAEAAAAALAAAAAABAAEAAAIBRAA7"
For Apple Airtags Location Tracker Soft Silicone P,"₦ 28,647","₦ 47,746",No rating,"data:image/gif;base64,R0lGODlhAQABAIAAAAAAAP///yH5BAEAAAAALAAAAAABAAEAAAIBRAA7"
Aq General Soft Silicone 360 Full Cover Case For Airtag Protector,"₦ 13,295","₦ 22,444",No rating,"data:image/gif;base64,R0lGODlhAQABAIAAAAAAAP///yH5BAEAAAAALAAAAAABAAEAAAIBRAA7"
Aq General Leather Airtag Holder For Apple Airtag Case Air Tag,"₦ 11,744","₦ 19,820",No rating,"data:image/gif;base64,R0lGODlhAQABAIAAAAAAAP///yH5BAEAAAAALAAAAAABAAEAAAIBRAA7"
"Kid Wristband Compatible with Apple AirTag, Protective Case for Air Tag GPS Tracker Holder with Nylon Bracelet G","₦ 3,198","₦ 6,002",No rating,"data:image/gif;base64,R0lGODlhAQABAIAAAAAAAP///yH5BAEAAAAALAAAAAABAAEAAAIBRAA7"
Case For AirTag Mecha PC Hard Protector With Metal Keychain Shockproof Anti-Scratch Fall Protect Cover For Air Tags,"₦ 14,015","₦ 16,303",No rating,"data:image/gif;base64,R0lGODlhAQABAIAAAAAAAP///yH5BAEAAAAALAAAAAABAAEAAAIBRAA7"
Suitable for Apple Airtag tracker protective case pet reflective belt bell fish bone pendant collar cat collar sky blue,"₦ 6,424","₦ 11,270",No rating,"data:image/gif;base64,R0lGODlhAQABAIAAAAAAAP///yH5BAEAAAAALAAAAAABAAEAAAIBRAA7"
Silicone Protective Cover W/Keychain For AirTags Luminous Blue,"₦ 2,271","₦ 3,179",No rating,"data:image/gif;base64,R0lGODlhAQABAIAAAAAAAP///yH5BAEAAAAALAAAAAABAAEAAAIBRAA7"
2 PCS Silicone Protective Case For AirTag-Pink,"₦ 4,730","₦ 6,757",No rating,"data:image/gif;base64,R0lGODlhAQABAIAAAAAAAP///yH5BAEAAAAALAAAAAABAAEAAAIBRAA7"
"2 Pack Waterproof Keychain Holder Case for Airtags ,for Luggage, Keys, Bags, Dog Pet Collar","₦ 6,199","₦ 11,644",5 out of 5,"data:image/gif;base64,R0lGODlhAQABAIAAAAAAAP///yH5BAEAAAAALAAAAAABAAEAAAIBRAA7"
Minimalist Slim Wallet With AirTag Case Credit ID Card Holder Elastic Small Wallet Key Bag 10 Card Holders Men Women Mini Purse,"₦ 41,900","₦ 72,241",No rating,"data:image/gif;base64,R0lGODlhAQABAIAAAAAAAP///yH5BAEAAAAALAAAAAABAAEAAAIBRAA7"
1pc Protective Cover For Apple Airtags Tracker Cas,"₦ 28,483 - ₦ 32,242","₦ 47,471 - ₦ 53,737",No rating,"data:image/gif;base64,R0lGODlhAQABAIAAAAAAAP///yH5BAEAAAAALAAAAAABAAEAAAIBRAA7"
Funda Impermeable Ipx8 Para Airtag Pegatina Ultra Adhesiva Soporte Para Etiqueta De Aire Rastreador Gps Funda Para Coche Tv Dron Remoto Equipaje,"₦ 40,719","₦ 54,978",No rating,"data:image/gif;base64,R0lGODlhAQABAIAAAAAAAP///yH5BAEAAAAALAAAAAABAAEAAAIBRAA7"
For Airtags Leather Protective Case With Key Ring,"₦ 34,108","₦ 56,847",No rating,"data:image/gif;base64,R0lGODlhAQABAIAAAAAAAP///yH5BAEAAAAALAAAAAABAAEAAAIBRAA7"
"Kid Wristband For Apple AirTag, GPS Tracker Holder","₦ 5,292","₦ 7,380",No rating,"data:image/gif;base64,R0lGODlhAQABAIAAAAAAAP///yH5BAEAAAAALAAAAAABAAEAAAIBRAA7"
New For Apple Airtags Locator Silicone Protective,"₦ 28,592 - ₦ 31,776","₦ 47,654 - ₦ 52,959",No rating,"data:image/gif;base64,R0lGODlhAQABAIAAAAAAAP///yH5BAEAAAAALAAAAAABAAEAAAIBRAA7"
For Airtags Locator Airtag Case Keychain Anti-lost Cover Sleeve Protective Case For Airtags Holder Air Tag,"₦ 14,085 - ₦ 14,438","₦ 16,400 - ₦ 16,895",No rating,"data:image/gif;base64,R0lGODlhAQABAIAAAAAAAP///yH5BAEAAAAALAAAAAABAAEAAAIBRAA7"
For Airtag IP68 Waterproof Full Cover PC Case With Key Ring,"₦ 5,090","₦ 7,271",No rating,"data:image/gif;base64,R0lGODlhAQABAIAAAAAAAP///yH5BAEAAAAALAAAAAABAAEAAAIBRAA7"
"2Pcs Case Compatible for Apple Airtag, PU Leather Skin Cover","₦ 3,910","₦ 7,820",No rating,"data:image/gif;base64,R0lGODlhAQABAIAAAAAAAP///yH5BAEAAAAALAAAAAABAAEAAAIBRAA7"
Airtag Case For FPV Air 2S Mini 2 Flying Anti-lost Mount Holder Bracket For Airtags Accessories,"₦ 14,008","₦ 16,293",No rating,"data:image/gif;base64,R0lGODlhAQABAIAAAAAAAP///yH5BAEAAAAALAAAAAABAAEAAAIBRAA7"
For Airtags Case Wallet Protective Holder Accessory Card Size Shape Case Anti-Lost Device Tracker Case Cover-Black,"₦ 2,297","₦ 4,382",No rating,https://ng.jumia.is/unsafe/fit-in/300x300/filters:fill(white)/product/08/1437051/1.jpg?7008
2-in-1 Silicone Protective Cover Anti-Slip Shock Absorption For AirTag Fire TV Stick 4K Remote Control,"₦ 29,900","₦ 51,551",No rating,https://ng.jumia.is/unsafe/fit-in/300x300/filters:fill(white)/product/58/5582531/1.jpg?5908
High-quality Casekey For Airtags Anti-lost Protective Cover Stand Blocking Multifunctional Wallet Clip,"₦ 14,826","₦ 17,438",No rating,https://ng.jumia.is/unsafe/fit-in/300x300/filters:fill(white)/product/79/6833732/1.jpg?8033
For AirTag Tracker Bicycle Headset Mount-Beer Cover-Round,"₦ 9,902","₦ 14,152",No rating,https://ng.jumia.is/unsafe/fit-in/300x300/filters:fill(white)/product/17/9443972/1.jpg?4269
Airtag Case For FPV Air 2S Mini 2 Flying Anti-lost Mount Holder Bracket For Airtags Accessories,"₦ 46,006","₦ 55,701",No rating,https://ng.jumia.is/unsafe/fit-in/300x300/filters:fill(white)/product/48/6583812/1.jpg?9020
AirTag Case Genuine Leather Key Ring Baseus For For AirTags-Black 2,"₦ 48,900","₦ 84,310",No rating,https://ng.jumia.is/unsafe/fit-in/300x300/filters:fill(white)/product/68/0394163/1.jpg?7611
AirTag Bike Mount ll AirTag Stem Cap Waterproof Bike cker Anti Theft Stealth Tag MTB AirTag Holder for Bicycle,"₦ 40,347","₦ 68,470",No rating,https://ng.jumia.is/unsafe/fit-in/300x300/filters:fill(white)/product/87/2842572/1.jpg?1938
For AirTag Bike Seat Mount Mountain Road Bicycle Taillight Reflector Holder for Airtag Anti-lost Location Case Bracket,"₦ 29,960","₦ 50,100",No rating,https://ng.jumia.is/unsafe/fit-in/300x300/filters:fill(white)/product/33/3262162/1.jpg?6180
"VIPERADE PJ25 Air Tag Holder, AirTag Keychain Genuine","₦ 159,745","₦ 159,863",No rating,https://ng.jumia.is/unsafe/fit-in/300x300/filters:fill(white)/product/00/2551053/1.jpg?7300
"Dog Collar, Reflective Air Tag Dog Collar for Apple Airtags","₦ 12,478","₦ 24,955",No rating,https://ng.jumia.is/unsafe/fit-in/300x300/filters:fill(white)/product/36/9044652/1.jpg?4391
Carbon Fiber Card Holder Airtag Men Bank Credit Cardholder Minimalist Wallet Metal Air Tag Male Vallet For Airtag Tarjetero,"₦ 31,730",No old price,No rating,https://ng.jumia.is/unsafe/fit-in/300x300/filters:fill(white)/product/95/2613292/1.jpg?4815
Leather Airtag Card Holder Badge Wallet Portable Cover For Starline S96v2 Alarm Tag And Intercom,"₦ 88,680","₦ 153,032",No rating,https://ng.jumia.is/unsafe/fit-in/300x300/filters:fill(white)/product/00/9131152/1.jpg?0192
2 PCS Silicone Protective Case For AirTag-Pink,"₦ 5,172","₦ 6,876",No rating,"data:image/gif;base64,R0lGODlhAQABAIAAAAAAAP///yH5BAEAAAAALAAAAAABAAEAAAIBRAA7"
"Suitable for Airtag protective case, deep waterproof children's wristband, cartoon style watch strap","₦ 12,874",No old price,No rating,"data:image/gif;base64,R0lGODlhAQABAIAAAAAAAP///yH5BAEAAAAALAAAAAABAAEAAAIBRAA7"
1/2/3pcs Mini Gps Tracker 4.0 Ios/android Compatible Smart Locator For Airtag Anti-Lost Device Keys Pet Kids Finder,"₦ 33,708","₦ 57,300",No rating,"data:image/gif;base64,R0lGODlhAQABAIAAAAAAAP///yH5BAEAAAAALAAAAAABAAEAAAIBRAA7"
"Compatible With AirTag Case Keychain Air Tag Holder, AirTags","₦ 76,086","₦ 76,127",No rating,"data:image/gif;base64,R0lGODlhAQABAIAAAAAAAP///yH5BAEAAAAALAAAAAABAAEAAAIBRAA7"
1~7pcs Mini Gps Tracker 4.0 Ios/android Compatible Smart Locator For Airtag Anti-Lost Device Keys Pet Kids Finder For,"₦ 29,220","₦ 49,680",No rating,"data:image/gif;base64,R0lGODlhAQABAIAAAAAAAP///yH5BAEAAAAALAAAAAABAAEAAAIBRAA7"
"For Airtag Tracking Locator Silicone Case, Color: Luminous O Luminous","₦ 8,479","₦ 12,120",No rating,"data:image/gif;base64,R0lGODlhAQABAIAAAAAAAP///yH5BAEAAAAALAAAAAABAAEAAAIBRAA7"
1/2/3pcs Mini Gps Tracker 4.0 Ios/android Compatible Smart Locator For Airtag Anti-Lost Device Keys Pet Kids Finder,"₦ 42,978","₦ 73,058",No rating,"data:image/gif;base64,R0lGODlhAQABAIAAAAAAAP///yH5BAEAAAAALAAAAAABAAEAAAIBRAA7"
"Silicone Case Compatible With AirTag, Bluetooth Tracker Holder With Key Chain, Lightweight Anti-Scratch Cover For AirTag Loop","₦ 6,580","₦ 11,860",5 out of 5,"data:image/gif;base64,R0lGODlhAQABAIAAAAAAAP///yH5BAEAAAAALAAAAAABAAEAAAIBRAA7"
Round Shape Carbon Fiber Case For AirTag,"₦ 6,270","₦ 8,957",No rating,"data:image/gif;base64,R0lGODlhAQABAIAAAAAAAP///yH5BAEAAAAALAAAAAABAAEAAAIBRAA7"
Bicycle Mount Holder Protect Case for AirTag Protective Cover Bike Anti-Theft Protection for Apple Airtags Air Tag,"₦ 28,373","₦ 48,430",No rating,"data:image/gif;base64,R0lGODlhAQABAIAAAAAAAP///yH5BAEAAAAALAAAAAABAAEAAAIBRAA7"
Clearance!!! Applicable to Apple Anti-Loss Alarm Device First Layer Cowhide Fixed Sets of Airtag Tracker Protective Case,"₦ 34,500","₦ 36,800",No rating,"data:image/gif;base64,R0lGODlhAQABAIAAAAAAAP///yH5BAEAAAAALAAAAAABAAEAAAIBRAA7"
For Apple Airtags Tracking Device Case For Airtags,"₦ 26,960 - ₦ 28,771","₦ 44,933 - ₦ 47,951",No rating,"data:image/gif;base64,R0lGODlhAQABAIAAAAAAAP///yH5BAEAAAAALAAAAAABAAEAAAIBRAA7"
Magnetic Adsorption Cover For Airtag Protective Sleeve Holder For Air Tag Locator Keychain Protector Metal Case,"₦ 14,791","₦ 17,389",No rating,"data:image/gif;base64,R0lGODlhAQABAIAAAAAAAP///yH5BAEAAAAALAAAAAABAAEAAAIBRAA7"
Mountain Bike Locator Hidden Bracket For AirTag-Reflector,"₦ 13,959","₦ 19,948",No rating,"data:image/gif;base64,R0lGODlhAQABAIAAAAAAAP///yH5BAEAAAAALAAAAAABAAEAAAIBRAA7"
For Airtag Tracker Locator Faux Leather Case,"₦ 4,756","₦ 6,806",No rating,"data:image/gif;base64,R0lGODlhAQABAIAAAAAAAP///yH5BAEAAAAALAAAAAABAAEAAAIBRAA7"
"4 Pack AirTag Case for Keychain, Silicone Tracker Holder","₦ 6,263","₦ 11,907",No rating,"data:image/gif;base64,R0lGODlhAQABAIAAAAAAAP///yH5BAEAAAAALAAAAAABAAEAAAIBRAA7"
GPS Tracker for Dogs Waterproof IP67 Pet Tracking Smart Collar Real-time Location No Monthly Fee Dog Tracker Collar for Small Medium Large Dogs Unlimited Range Dog Tracking Tag for Airtag for iOS,"₦ 87,528","₦ 146,904",No rating,"data:image/gif;base64,R0lGODlhAQABAIAAAAAAAP///yH5BAEAAAAALAAAAAABAAEAAAIBRAA7"
For Airtag Case Saffiano Leather Keychain Protective Cover For Air Tag Dog Traker Locator Device,"₦ 87,480","₦ 150,964",No rating,"data:image/gif;base64,R0lGODlhAQABAIAAAAAAAP///yH5BAEAAAAALAAAAAABAAEAAAIBRAA7"
"Kid Wristband Compatible with Apple AirTag, Protective Case","₦ 2,367","₦ 4,733",No rating,"data:image/gif;base64,R0lGODlhAQABAIAAAAAAAP///yH5BAEAAAAALAAAAAABAAEAAAIBRAA7"
"New Airtag Invisible for Children, Elderly, Luggage, Pet Clothes, Pin Loss Protector","₦ 14,602",No old price,No rating,"data:image/gif;base64,R0lGODlhAQABAIAAAAAAAP///yH5BAEAAAAALAAAAAABAAEAAAIBRAA7"
Carry Silicone Case Cover For AirTags Shock Absorbing Orange,"₦ 2,443","₦ 3,176",No rating,"data:image/gif;base64,R0lGODlhAQABAIAAAAAAAP///yH5BAEAAAAALAAAAAABAAEAAAIBRAA7"
"AirTag Bracelet Kids, AirTag Wristband for Holder Kid airTags Adjustable Watch Band Toddler Anti-Lost Hidden Case Child-Friendly Silicone for Boys (Green,Blue)","₦ 38,318","₦ 53,613",No rating,"data:image/gif;base64,R0lGODlhAQABAIAAAAAAAP///yH5BAEAAAAALAAAAAABAAEAAAIBRAA7"
For Airtag Keychain Cartoon Cute Astronaut Soft Silicone Skin Cover For AirTags GPS Locator Air Tag Key Holder,"₦ 14,590","₦ 17,108",No rating,"data:image/gif;base64,R0lGODlhAQABAIAAAAAAAP///yH5BAEAAAAALAAAAAABAAEAAAIBRAA7"
Bicycle Mount Holder Protect Case for AirTag Protective Cover Bike Anti-Theft Protection for Apple Airtags Air Tag,"₦ 28,373","₦ 48,430",No rating,"data:image/gif;base64,R0lGODlhAQABAIAAAAAAAP///yH5BAEAAAAALAAAAAABAAEAAAIBRAA7"
Credit Card Holders Airtag Wallet Men Carbon Fiber Thin Bank Cardholder Case Airt Tag Male Smart Minimalist Wallet Macsafe,"₦ 34,884","₦ 60,168",No rating,"data:image/gif;base64,R0lGODlhAQABAIAAAAAAAP///yH5BAEAAAAALAAAAAABAAEAAAIBRAA7"
Carry Case Protective Skin Cover For Apple Airtags,"₦ 26,082","₦ 43,470",No rating,"data:image/gif;base64,R0lGODlhAQABAIAAAAAAAP///yH5BAEAAAAALAAAAAABAAEAAAIBRAA7"
Card Holder Men Wallets Money Bag Male Black Short Purse Small Leather Slim Wallets Mini Wallets For Airtag Air Tag,"₦ 35,070","₦ 60,120",No rating,"data:image/gif;base64,R0lGODlhAQABAIAAAAAAAP///yH5BAEAAAAALAAAAAABAAEAAAIBRAA7"
Cartera Airtag De Cuero Genuino Para Hombre Y Mujer Funda Con Soporte Para Tarjeta De Cré Identificación Rastreador De Protección Antipérdida,"₦ 45,864","₦ 61,887",No rating,"data:image/gif;base64,R0lGODlhAQABAIAAAAAAAP///yH5BAEAAAAALAAAAAABAAEAAAIBRAA7"
"Anti-Lost Silicone Band let Protectie Case for -Apple AirTag for Children , Adjustable Wristband for Children","₦ 33,066","₦ 56,780",No rating,https://ng.jumia.is/unsafe/fit-in/300x300/filters:fill(white)/product/83/5103482/1.jpg?5691
2 PCS Silicone Protective Case For AirTag-Pink,"₦ 5,172","₦ 6,876",No rating,https://ng.jumia.is/unsafe/fit-in/300x300/filters:fill(white)/product/33/6968513/1.jpg?2955
Leather Key Ring For Apple Airtags Case Protector,"₦ 33,035","₦ 55,107",No rating,https://ng.jumia.is/unsafe/fit-in/300x300/filters:fill(white)/product/79/5065903/1.jpg?3175
Apple Airtags shock-absorbing and scratch resistant protective case with keychainApple Airtags shock-absorbing and scratch resistant protective case with keychain - Camouflages Green,"₦ 14,850","₦ 17,550",No rating,https://ng.jumia.is/unsafe/fit-in/300x300/filters:fill(white)/product/48/1747703/1.jpg?7185
For Airtag Positioner Fiber Card Clip Magnetic,"₦ 16,039","₦ 22,927",No rating,https://ng.jumia.is/unsafe/fit-in/300x300/filters:fill(white)/product/91/5536933/1.jpg?5272
2 Pack Ipx8 Waterproof Case For Airtag Dog Collar Bracket Hidden Air Label Protect Cover Liquid Silicone For Air Tag Case,"₦ 35,045","₦ 47,378",No rating,https://ng.jumia.is/unsafe/fit-in/300x300/filters:fill(white)/product/42/6133153/1.jpg?2828
Mini Gps Tracker 4.0 Ios/android Compatible Smart Locator For Airtag Anti-Lost Device Keys Pet Kids Finder For Apple,"₦ 30,386","₦ 51,653",No rating,https://ng.jumia.is/unsafe/fit-in/300x300/filters:fill(white)/product/34/6292372/1.jpg?4215
Airtag Nylon Cat Collars Adjustable Puppy Kitten Necklace Cats Dogs Rabbit Collars For Gatos Accesorios Collier Chat Pet Items,"₦ 31,605","₦ 42,630",No rating,https://ng.jumia.is/unsafe/fit-in/300x300/filters:fill(white)/product/01/0338253/1.jpg?6435
"For AirTag Bike Mount, Anti-Theft Bicycle Mounts Bicycle Fro","₦ 8,379","₦ 16,758",No rating,https://ng.jumia.is/unsafe/fit-in/300x300/filters:fill(white)/product/05/2102462/1.jpg?8987
2pcs Scratch Resistant Gps Tracker Protective Case Pet Collar Ip67 Waterproof Luggage With Keyring Cover Durable Fit For Airtag,"₦ 37,500","₦ 63,755",No rating,https://ng.jumia.is/unsafe/fit-in/300x300/filters:fill(white)/product/65/1425382/1.jpg?1426
"Kid Wristband Compatible with Apple AirTag, Protective Case for Air Tag GPS Tracker Holder with Nylon Bracelet B","₦ 2,837","₦ 5,314",No rating,https://ng.jumia.is/unsafe/fit-in/300x300/filters:fill(white)/product/73/0514232/1.jpg?3884
Carbon Fiber For Airtag Wallet Men Business ID Credit Card Holder Slim Anti Protect Airtag Slide Wallet Dropship,"₦ 31,644",No old price,No rating,https://ng.jumia.is/unsafe/fit-in/300x300/filters:fill(white)/product/32/3221023/1.jpg?2213
"Tracker Card Holder For AirTag, Style: Crazy Horse (Red)","₦ 11,530","₦ 20,754",No rating,"data:image/gif;base64,R0lGODlhAQABAIAAAAAAAP///yH5BAEAAAAALAAAAAABAAEAAAIBRAA7"
High Quality Leather Case For Airtags Protective Cover For Locator Tracker Antilost Device Keychain Protect SleeveRed,"₦ 18,840","₦ 32,472",No rating,"data:image/gif;base64,R0lGODlhAQABAIAAAAAAAP///yH5BAEAAAAALAAAAAABAAEAAAIBRAA7"
"Tracker Card Holder For AirTag, Style: Crazy Horse (Green)","₦ 11,530","₦ 20,754",No rating,"data:image/gif;base64,R0lGODlhAQABAIAAAAAAAP///yH5BAEAAAAALAAAAAABAAEAAAIBRAA7"
Airtag Pocket Men Wallet Slim Anti-theft Small Wallet Bifold Thin Male,"₦ 32,900","₦ 56,724",No rating,"data:image/gif;base64,R0lGODlhAQABAIAAAAAAAP///yH5BAEAAAAALAAAAAABAAEAAAIBRAA7"
Wallets Small Purse Air Tags Case Bag AirTags Tracker,"₦ 37,948","₦ 58,491",No rating,"data:image/gif;base64,R0lGODlhAQABAIAAAAAAAP///yH5BAEAAAAALAAAAAABAAEAAAIBRAA7"
Silicone Bracelet Strap Case For AirTag,"₦ 8,290","₦ 11,842",No rating,"data:image/gif;base64,R0lGODlhAQABAIAAAAAAAP///yH5BAEAAAAALAAAAAABAAEAAAIBRAA7"
"Anti-Lost Silicone Band let Protectie Case for -Apple AirTag for Children , Adjustable Wristband for Children","₦ 33,066","₦ 56,780",No rating,"data:image/gif;base64,R0lGODlhAQABAIAAAAAAAP///yH5BAEAAAAALAAAAAABAAEAAAIBRAA7"
"Kid Wristband Compatible with Apple AirTag, Protective Case","₦ 2,102","₦ 4,204",No rating,"data:image/gif;base64,R0lGODlhAQABAIAAAAAAAP///yH5BAEAAAAALAAAAAABAAEAAAIBRAA7"
l Silicone Case Cover For AirTag,"₦ 5,233","₦ 7,487",No rating,"data:image/gif;base64,R0lGODlhAQABAIAAAAAAAP///yH5BAEAAAAALAAAAAABAAEAAAIBRAA7"
4 PCS Tracker Silicone Protective Cover For AirTag,"₦ 15,980","₦ 22,828",No rating,"data:image/gif;base64,R0lGODlhAQABAIAAAAAAAP///yH5BAEAAAAALAAAAAABAAEAAAIBRAA7"
Airtag Case For FPV Air 2S Mini 2 Flying Anti-lost Mount Holder Bracket For Airtags Accessories,"₦ 14,008","₦ 16,293",No rating,"data:image/gif;base64,R0lGODlhAQABAIAAAAAAAP///yH5BAEAAAAALAAAAAABAAEAAAIBRAA7"
"Cat Collar Holder, For Air Tag Cat Collar Holder Compatible For Apple Airtag ,2Pack Case Cover","₦ 28,373","₦ 48,430",No rating,"data:image/gif;base64,R0lGODlhAQABAIAAAAAAAP///yH5BAEAAAAALAAAAAABAAEAAAIBRAA7"
Wallets Small Purse Air Tags Case Bag AirTags Tracker,"₦ 22,169","₦ 33,254",No rating,"data:image/gif;base64,R0lGODlhAQABAIAAAAAAAP///yH5BAEAAAAALAAAAAABAAEAAAIBRAA7"
New Anti-Lost Pet Dog Collar For Apple Air-Tag Protective Tracker Waterproof For Pet Dog Cat Dog Anti Lost Positioning Collar,"₦ 30,569","₦ 51,974",No rating,"data:image/gif;base64,R0lGODlhAQABAIAAAAAAAP///yH5BAEAAAAALAAAAAABAAEAAAIBRAA7"
2pack Keychain For Airtags Case Protective Cover Airtag Holder Gps Accessories Air Tag Case Key Ring Holder,"₦ 25,725","₦ 34,692",No rating,"data:image/gif;base64,R0lGODlhAQABAIAAAAAAAP///yH5BAEAAAAALAAAAAABAAEAAAIBRAA7"
(Pink 02)Leather Keychain For Apple Airtags Case Protector Cover Shell Tracker Anti-scratch For Air Tag Key Ring Holder Accessories RA,"₦ 23,798","₦ 29,748",No rating,"data:image/gif;base64,R0lGODlhAQABAIAAAAAAAP///yH5BAEAAAAALAAAAAABAAEAAAIBRAA7"
"Dog Collar, Reflective Air Tag Dog Collar for Apple Airtags","₦ 9,232","₦ 18,463",No rating,"data:image/gif;base64,R0lGODlhAQABAIAAAAAAAP///yH5BAEAAAAALAAAAAABAAEAAAIBRAA7"
Pet Collar For Airtag Dog Cat S Adjustable Sleeve Suitable Air Tags AntiScratch Silicone Protective Cover For Airtags1,"₦ 18,840","₦ 32,472",No rating,"data:image/gif;base64,R0lGODlhAQABAIAAAAAAAP///yH5BAEAAAAALAAAAAABAAEAAAIBRAA7"
"Silicone Case Compatible With AirTag, Bluetooth Tracker Holder With Key Chain, Lightweight Anti-Scratch Cover For AirTag Loop","₦ 6,580","₦ 11,860",No rating,"data:image/gif;base64,R0lGODlhAQABAIAAAAAAAP///yH5BAEAAAAALAAAAAABAAEAAAIBRAA7"
Esr 2pcs For Apple Airtags Silicone Protector Cove,"₦ 32,914","₦ 54,857",No rating,"data:image/gif;base64,R0lGODlhAQABAIAAAAAAAP///yH5BAEAAAAALAAAAAABAAEAAAIBRAA7"
Pet Collar For Airtag GPS Tracker CatRed,"₦ 34,884","₦ 60,168",No rating,"data:image/gif;base64,R0lGODlhAQABAIAAAAAAAP///yH5BAEAAAAALAAAAAABAAEAAAIBRAA7"
Pet Collar Whiskertrack Waterproof Gps Cat Collar with Airtag Black,"₦ 7,849","₦ 11,774",No rating,"data:image/gif;base64,R0lGODlhAQABAIAAAAAAAP///yH5BAEAAAAALAAAAAABAAEAAAIBRAA7"
Waterproof Cat Collar Stylish Feline Gps Collar Waterproof for Airtag Sky Blue,"₦ 3,892","₦ 5,842",No rating,"data:image/gif;base64,R0lGODlhAQABAIAAAAAAAP///yH5BAEAAAAALAAAAAABAAEAAAIBRAA7"
Card Holder Men Wallets Money Bag Male Black Short Purse Small Leather Slim Wallets Mini Wallets For Airtag Air Tag,"₦ 35,070","₦ 60,120",No rating,"data:image/gif;base64,R0lGODlhAQABAIAAAAAAAP///yH5BAEAAAAALAAAAAABAAEAAAIBRAA7"
CONTACT'S Leather AirTag Wallets Short Male Card Holders Coin Purses,"₦ 30,340","₦ 41,508",No rating,"data:image/gif;base64,R0lGODlhAQABAIAAAAAAAP///yH5BAEAAAAALAAAAAABAAEAAAIBRAA7"
Bike Holder Bracket Protective For Airtag Air Tag Anti-Theft Gps Tracking Bicycle Water Bottle Mount Protect Slelf,"₦ 38,777","₦ 65,915",No rating,"data:image/gif;base64,R0lGODlhAQABAIAAAAAAAP///yH5BAEAAAAALAAAAAABAAEAAAIBRAA7"
Protective Case For Airtags Locator Tracker Anti-L,"₦ 33,134 - ₦ 33,257","₦ 55,223 - ₦ 55,429",No rating,"data:image/gif;base64,R0lGODlhAQABAIAAAAAAAP///yH5BAEAAAAALAAAAAABAAEAAAIBRAA7"
"VIPERADE PJ25 Air Tag Holder, AirTag Keychain Genuine","₦ 76,086","₦ 76,127",No rating,"data:image/gif;base64,R0lGODlhAQABAIAAAAAAAP///yH5BAEAAAAALAAAAAABAAEAAAIBRAA7"
CONTACT'S Leather Men AirTag Wallets Key Holders Metal Chain Zip Card Holder Coin Purses,"₦ 19,706",No old price,No rating,https://ng.jumia.is/unsafe/fit-in/300x300/filters:fill(white)/product/94/5713292/1.jpg?5411
Bluetooth Key Finder with Global Apple Find My NetworkiOS Only Smart AirTag cker Item for Bags Luage,"₦ 113,198","₦ 192,888",No rating,https://ng.jumia.is/unsafe/fit-in/300x300/filters:fill(white)/product/24/5689733/1.jpg?0890
For 2017 Apple TV HD/4K Siri Remote 1St Gen Case for AirTag,"₦ 9,450","₦ 13,946",No rating,https://ng.jumia.is/unsafe/fit-in/300x300/filters:fill(white)/product/94/4974403/1.jpg?9548
For Airtag Keychain Cartoon Cute Astronaut Soft Silicone Skin Cover For AirTags GPS Locator Air Tag Key Holder,"₦ 14,590","₦ 17,108",No rating,https://ng.jumia.is/unsafe/fit-in/300x300/filters:fill(white)/product/42/2833732/1.jpg?8001
