Name,Price,Old Price,Rating,Product Image
For 2017 Apple TV HD/4K Siri Remote 1St Gen Case for AirTag,"₦ 8,462","₦ 16,744",No rating,https://ng.jumia.is/unsafe/fit-in/300x300/filters:fill(white)/product/83/2909272/1.jpg?1026
1~5pcs Airtag Case Transparent Tpu Cover Keychain For Airtag Key Holder Air Tag Full Shell Waterproof Shockproof,"₦ 23,436","₦ 39,839",No rating,https://ng.jumia.is/unsafe/fit-in/300x300/filters:fill(white)/product/05/6737243/1.jpg?4603
Replacement For Apple Airtags Tracker Cover Silicone,"₦ 7,304","₦ 11,273",No rating,https://ng.jumia.is/unsafe/fit-in/300x300/filters:fill(white)/product/81/3952803/1.jpg?2436
Card Holder Men Wallets Money Bag Male Black Short Purse Small Leather Slim Wallets Mini Wallets For Airtag Air Tag,"₦ 35,070","₦ 60,120",No rating,https://ng.jumia.is/unsafe/fit-in/300x300/filters:fill(white)/product/26/4627372/1.jpg?0231
2 Pack Keychain Holder Case For Airtags For Luggage Keys Bags Dog Pet Collar,"₦ 32,580","₦ 55,392",No rating,https://ng.jumia.is/unsafe/fit-in/300x300/filters:fill(white)/product/92/7630792/1.jpg?2960
Bicycle Front Fork Down Tube Bracket for AirTag Anti~Theft Bike cker Mount Holder for Air Tag Case Bike Headset Cap Cover,"₦ 170,173","₦ 292,250",No rating,https://ng.jumia.is/unsafe/fit-in/300x300/filters:fill(white)/product/97/0342572/1.jpg?0971
Bicycle Front Fork Down Tube Bracket for AirTag Anti~Theft Bike cker Mount Holder for Air Tag Case Bike Headset Cap Cover,"₦ 170,173","₦ 292,250",No rating,https://ng.jumia.is/unsafe/fit-in/300x300/filters:fill(white)/product/47/2783572/1.jpg?6793
Card Holder For Airtag,"₦ 35,590","₦ 50,842",No rating,https://ng.jumia.is/unsafe/fit-in/300x300/filters:fill(white)/product/86/9510263/1.jpg?3314
"Bicycle Bell for Apple AirTag, AirTag Bike Mount Holder , Fit 0.87in/22.2mm Size Bicycle Handlebar","₦ 40,063","₦ 68,470",No rating,"data:image/gif;base64,R0lGODlhAQABAIAAAAAAAP///yH5BAEAAAAALAAAAAABAAEAAAIBRAA7"
Secure Holder With Strap For Apple Airtag Case Protective,"₦ 12,099 - ₦ 12,199","₦ 18,450 - ₦ 18,600",No rating,"data:image/gif;base64,R0lGODlhAQABAIAAAAAAAP///yH5BAEAAAAALAAAAAABAAEAAAIBRAA7"
Card Holder Men Women Airtag Wallet Money Bag Leather Purse Slim Thin Wallets For Apple AirTags cker Air Tag,"₦ 35,070","₦ 60,120",No rating,"data:image/gif;base64,R0lGODlhAQABAIAAAAAAAP///yH5BAEAAAAALAAAAAABAAEAAAIBRAA7"
For Airtag IP68 Waterproof Full Cover PC Case With Key Ring,"₦ 5,090","₦ 7,271",No rating,"data:image/gif;base64,R0lGODlhAQABAIAAAAAAAP///yH5BAEAAAAALAAAAAABAAEAAAIBRAA7"
(blue)2 In 1 Airtag Wireless Bluetooth Earphone Case For Airpods Pro Armor Camera 3D Headphone Charging Box Cover For Airpods 1/2/3 MAS,"₦ 22,941","₦ 28,676",No rating,"data:image/gif;base64,R0lGODlhAQABAIAAAAAAAP///yH5BAEAAAAALAAAAAABAAEAAAIBRAA7"
Cup Holder Bicycle Accessories Mountain Bike Water Bottle Holder Carbon Bicycle Term Door Airtag Bike Mount Bottle Cage Adapter,"₦ 53,323","₦ 91,850",No rating,"data:image/gif;base64,R0lGODlhAQABAIAAAAAAAP///yH5BAEAAAAALAAAAAABAAEAAAIBRAA7"
Protective Case for SmartTag or for Apple Airtags Anti-lost Bike Keychain Bike Seat Arch Bracket Cover,"₦ 40,097","₦ 68,470",No rating,"data:image/gif;base64,R0lGODlhAQABAIAAAAAAAP///yH5BAEAAAAALAAAAAABAAEAAAIBRAA7"
Bicycle Bell for Apple AirTag Holder in Bell Bicycle Anti-Theft Road Approved Tool Included,"₦ 28,373","₦ 48,430",No rating,"data:image/gif;base64,R0lGODlhAQABAIAAAAAAAP///yH5BAEAAAAALAAAAAABAAEAAAIBRAA7"
"Kid Wristband Compatible with Apple AirTag, Protective Case","₦ 2,102","₦ 4,204",No rating,"data:image/gif;base64,R0lGODlhAQABAIAAAAAAAP///yH5BAEAAAAALAAAAAABAAEAAAIBRAA7"
Bicycle Mount Holder Protect Case for AirTag Protective Cover Bike Anti-Theft Protection for Apple Airtags Air Tag,"₦ 28,373","₦ 48,430",No rating,"data:image/gif;base64,R0lGODlhAQABAIAAAAAAAP///yH5BAEAAAAALAAAAAABAAEAAAIBRAA7"
6pcs Pet Collar For Airtag Dog Cat Strap Adjustable Sleeve Suitable Air Tags Anti-Scratch Protective Cover For Airtags,"₦ 53,073","₦ 90,230",No rating,"data:image/gif;base64,R0lGODlhAQABAIAAAAAAAP///yH5BAEAAAAALAAAAAABAAEAAAIBRAA7"
1pc Airtag Dog Collar Holder Silicone Appl Air Tag Protective Cover Case Suitable For Cat And Pet Collar Harness Ring,"₦ 21,000","₦ 35,700",No rating,"data:image/gif;base64,R0lGODlhAQABAIAAAAAAAP///yH5BAEAAAAALAAAAAABAAEAAAIBRAA7"
1pc Airtag Dog Collar Holder Silicone Appl Air Tag Protective Cover Case Suitable For Cat And Pet Collar Harness Ring,"₦ 21,000","₦ 35,700",No rating,"data:image/gif;base64,R0lGODlhAQABAIAAAAAAAP///yH5BAEAAAAALAAAAAABAAEAAAIBRAA7"
1pc Airtag Dog Collar Holder Silicone Appl Air Tag Protective Cover Case Suitable For Cat And Pet Collar Harness Ring,"₦ 21,408","₦ 36,396",No rating,"data:image/gif;base64,R0lGODlhAQABAIAAAAAAAP///yH5BAEAAAAALAAAAAABAAEAAAIBRAA7"
1~10pcs 2023 Pet Collar For Airtag Dog Cat Strap Adjustable Sleeve Suitable Air Tags Anti-Scratch Protective Cover For Airtags,"₦ 26,347","₦ 44,783",No rating,"data:image/gif;base64,R0lGODlhAQABAIAAAAAAAP///yH5BAEAAAAALAAAAAABAAEAAAIBRAA7"
For Llavero Airtag Case Airtags Dog For Silicone,"₦ 46,003","₦ 55,709",No rating,"data:image/gif;base64,R0lGODlhAQABAIAAAAAAAP///yH5BAEAAAAALAAAAAABAAEAAAIBRAA7"
For Apple Airtags Case Silicone Keychain Protective Cover For Apple Airtag air tag cker Device Anti-lost Bumper Shell,"₦ 28,390","₦ 48,430",No rating,"data:image/gif;base64,R0lGODlhAQABAIAAAAAAAP///yH5BAEAAAAALAAAAAABAAEAAAIBRAA7"
Custom Gold Initial Letters For Air Tags Case Keychain Protective For Air Tag Locator Device For Airtags Case-camel gold,"₦ 21,754","₦ 29,353",No rating,"data:image/gif;base64,R0lGODlhAQABAIAAAAAAAP///yH5BAEAAAAALAAAAAABAAEAAAIBRAA7"
4PCS On For AirTag Case With Key Chain Silicone Protective Cases For AirTags Air Tag Tags Protector Fundas,"₦ 14,466","₦ 16,934",No rating,"data:image/gif;base64,R0lGODlhAQABAIAAAAAAAP///yH5BAEAAAAALAAAAAABAAEAAAIBRAA7"
For Airtag Pc Mini Protective Cover Gps Tracker Keychain Holdercase Antilost Keychain Bluetooth Key Finder Case Gps Mini Locator,"₦ 21,144","₦ 35,940",No rating,"data:image/gif;base64,R0lGODlhAQABAIAAAAAAAP///yH5BAEAAAAALAAAAAABAAEAAAIBRAA7"
For AirTag Case Genuine Key Ring For AirTags Keychain Device Protect Sleeve Protector Bumper,"₦ 14,819","₦ 17,428",No rating,"data:image/gif;base64,R0lGODlhAQABAIAAAAAAAP///yH5BAEAAAAALAAAAAABAAEAAAIBRAA7"
For Apple Airtag Xundd Silicone Protector Shockproof For,"₦ 13,557","₦ 27,113",No rating,"data:image/gif;base64,R0lGODlhAQABAIAAAAAAAP///yH5BAEAAAAALAAAAAABAAEAAAIBRAA7"
Airtag-compatible Cover Collar For Cat Portable Anti-Lost,"₦ 4,719","₦ 8,820",No rating,"data:image/gif;base64,R0lGODlhAQABAIAAAAAAAP///yH5BAEAAAAALAAAAAABAAEAAAIBRAA7"
1~10PCS Bicycle Holder for Airtag Bike Mount Anti Loss Anti~theft cking Locating Bracket Bicycle Headset Cover for Airtag,"₦ 113,961","₦ 195,390",No rating,"data:image/gif;base64,R0lGODlhAQABAIAAAAAAAP///yH5BAEAAAAALAAAAAABAAEAAAIBRAA7"
Bicycle Bottle Holder with Screws/Wrench Bike Bottle Cage Scratch-Proof Built-in for Airtag To Locate Anti-Theft Stowage,"₦ 39,128","₦ 66,800",No rating,"data:image/gif;base64,R0lGODlhAQABAIAAAAAAAP///yH5BAEAAAAALAAAAAABAAEAAAIBRAA7"
Universal Bicycle Mount Bracket Protective Cover For Apple AirTag Bike Water Bottle Case Holder For Airtag,"₦ 29,108","₦ 50,100",No rating,"data:image/gif;base64,R0lGODlhAQABAIAAAAAAAP///yH5BAEAAAAALAAAAAABAAEAAAIBRAA7"
Metal Protective Case For Apple Airtags Bluetooth,"₦ 33,079","₦ 55,132",No rating,"data:image/gif;base64,R0lGODlhAQABAIAAAAAAAP///yH5BAEAAAAALAAAAAABAAEAAAIBRAA7"
Silicone Case For Apple Airtags Liquid Protective,"₦ 28,496","₦ 47,494",No rating,"data:image/gif;base64,R0lGODlhAQABAIAAAAAAAP///yH5BAEAAAAALAAAAAABAAEAAAIBRAA7"
